{
  "schema_version": 2,
  "run_id": "synthetic-guidellm-sweep-fixture",
  "deployment_scope": "single-node",
  "accelerator_key": "nvidia-h200-x8",
  "harness": "guidellm==0.3.0",
  "metrics": {
    "ttft_ms_p50": 738,
    "ttft_ms_p90": 3800,
    "ttft_ms_p95": 4708,
    "ttft_ms_p99": 6100,
    "itl_ms_p50": 19.5,
    "itl_ms_p90": 35.0,
    "itl_ms_p95": 42.0,
    "itl_ms_p99": 68.0,
    "output_tok_s": 649,
    "total_tok_s": 6126,
    "total_requests": 189,
    "duration_seconds": 300,
    "concurrency": 16
  },
  "sweep": [
    {"concurrency": 1, "ttft_ms_p50": 85, "ttft_ms_p90": 105, "ttft_ms_p95": 120, "ttft_ms_p99": 145, "itl_ms_p50": 14.0, "itl_ms_p90": 16.5, "itl_ms_p95": 17.8, "itl_ms_p99": 22.0, "output_tok_s": 65, "total_tok_s": 8065, "total_requests": 20, "duration_seconds": 300},
    {"concurrency": 4, "ttft_ms_p50": 195, "ttft_ms_p90": 310, "ttft_ms_p95": 380, "ttft_ms_p99": 520, "itl_ms_p50": 15.2, "itl_ms_p90": 19.0, "itl_ms_p95": 21.5, "itl_ms_p99": 28.0, "output_tok_s": 248, "total_tok_s": 8248, "total_requests": 75, "duration_seconds": 300},
    {"concurrency": 16, "ttft_ms_p50": 738, "ttft_ms_p90": 3800, "ttft_ms_p95": 4708, "ttft_ms_p99": 6100, "itl_ms_p50": 19.5, "itl_ms_p90": 35.0, "itl_ms_p95": 42.0, "itl_ms_p99": 68.0, "output_tok_s": 649, "total_tok_s": 6126, "total_requests": 189, "duration_seconds": 300},
    {"concurrency": 32, "ttft_ms_p50": 1520, "ttft_ms_p90": 6500, "ttft_ms_p95": 8200, "ttft_ms_p99": 11500, "itl_ms_p50": 24.0, "itl_ms_p90": 45.0, "itl_ms_p95": 55.0, "itl_ms_p99": 82.0, "output_tok_s": 890, "total_tok_s": 5420, "total_requests": 265, "duration_seconds": 300},
    {"concurrency": 64, "ttft_ms_p50": 3100, "ttft_ms_p90": 11200, "ttft_ms_p95": 14500, "ttft_ms_p99": 19000, "itl_ms_p50": 32.0, "itl_ms_p90": 62.0, "itl_ms_p95": 78.0, "itl_ms_p99": 110.0, "output_tok_s": 1050, "total_tok_s": 4800, "total_requests": 315, "duration_seconds": 300},
    {"concurrency": 128, "ttft_ms_p50": 6200, "ttft_ms_p90": 18000, "ttft_ms_p95": 22000, "ttft_ms_p99": 28000, "itl_ms_p50": 44.0, "itl_ms_p90": 85.0, "itl_ms_p95": 105.0, "itl_ms_p99": 150.0, "output_tok_s": 1120, "total_tok_s": 4200, "total_requests": 340, "duration_seconds": 300}
  ]
}
